{
  "project_name": "faam-eni-circular-energy",
  "generated_at": "2026-04-04",
  "novelty_summary": "The project's strongest novelty position is the integration of an ISO 23247-compliant digital twin with electrified LFP CAM manufacturing — a combination that has no precedent in published literature or patents. Three defensible novelty anchors emerge: (1) the first digital twin for upstream CAM powder synthesis (spray drying + calcination + milling), filling a documented gap between electrode-level DTs (ARTISTIC) and cell-level DTs (DiBaZ); (2) the first fully electrified LFP CAM production plant in Europe, eliminating Scope 1 process heat emissions against a gas-fired Asian benchmark; and (3) the novel combination of ISO 23247 architecture with multi-scale physics-based modeling for real-time process control in chemical powder manufacturing, a domain where no ISO 23247 implementation exists. Two additional positions — geographic first in Italy/Southern Europe and PAT framework transfer from pharmaceuticals — are supportable but carry narrower defensibility. The brownfield conversion claim is weakest, being a site-level attribute rather than a technical novelty.",
  "novelty_anchors": [
    {
      "anchor_id": "NOV-001",
      "claim": "First integrated digital twin for LFP cathode active material powder synthesis (spray drying, calcination, milling), filling the documented gap between electrode-level DTs and cell-level DTs in the battery manufacturing chain.",
      "novelty_type": "first",
      "dimension": "technical",
      "existing_art": "ARTISTIC platform covers electrode manufacturing (slurry to cell) including LFP chemistry [SRC-003, SRC-004]. Fraunhofer DiBaZ covers cell-level production [SRC-DT-REPORT]. TwinHeat covers furnace heat treatment optimization but for metallurgical processes, not CAM synthesis [SRC-DT-REPORT]. Li et al. (2024) demonstrated a DT for LFP battery pack assembly lines [SRC-006]. Ma et al. (2023) modeled NMC sintering furnaces but did not implement an integrated DT [SRC-014].",
      "gap": "No published or patented digital twin exists for upstream CAM powder production from precursors. The spray drying to calcination to milling chain — where final CAM quality is determined — has no DT coverage in the literature. Systematic searches across Ayerbe et al. (2021) and Dubarry et al. (2023) confirm this gap.",
      "supported_by": ["SRC-001", "SRC-002", "SRC-003", "SRC-004", "SRC-006", "SRC-007", "SRC-014", "SRC-DT-REPORT"],
      "confidence": "high",
      "attack_surface": "An evaluator could argue: (a) Chinese LFP producers may have unpublished internal DT implementations that are not visible in English-language literature; (b) TwinHeat's furnace DT is close enough that this is merely an incremental application rather than a genuine first; (c) the lack of published DTs may reflect lack of need rather than a genuine gap. Defense: the gap is confirmed by two independent review papers [SRC-001, SRC-002], the deep-dive report, and a patent landscape scan showing white space. The ARTISTIC group explicitly scoped their work to electrode manufacturing, not CAM synthesis.",
      "defensibility_score": 8,
      "related_claims": ["CLM-005", "CLM-007", "CLM-016", "CLM-017", "CLM-018"]
    },
    {
      "anchor_id": "NOV-002",
      "claim": "First fully electrified LFP CAM production plant in Europe, designed as a future-proof investment for the 2030 decarbonized grid: replacing natural gas-fired spray drying and calcination with electric resistance heating and HTHP systems powered by renewable electricity, eliminating Scope 1 process heat emissions and delivering 55–70% GHG reduction by 2030 (rising to 80–90% by 2035) vs gas-fired Asian benchmark.",
      "novelty_type": "first",
      "dimension": "process",
      "existing_art": "Dominant Chinese LFP producers (CATL, BYD, Gotion, Dynanonic) use natural gas-fired rotary kilns for calcination [SRC-022, SRC-PAT-005]. FREYR Battery has an Innovation Fund grant for LFP CAM in Finland but has not specified full electrification of process heat and has not reached FID for Vaasa — FREYR is currently prioritizing US Giga America and is 'evaluating options' for European assets [SRC-025, CLM-029]. Electrified calcination has been demonstrated in cement [SRC-ED-007, SRC-ED-008] and lime [SRC-ED-006]. Electric roller hearth kilns are the industry standard for NMC CAM calcination (Jo et al., 2025; NGK vendor data) [SRC-ED-010, SRC-ED-023]. HTHP integration for spray drying has been demonstrated at COP 3.04–3.6 in peer-reviewed literature [SRC-ED-004, SRC-ED-005]. Kanthal (Sandvik) documents 95% thermal efficiency for electric kilns vs 25–60% for gas kilns [SRC-ED-009]. None of these technologies has been applied specifically to LFP CAM synthesis.",
      "gap": "No operational or funded LFP CAM plant has been documented as using fully electrified process heat for both spray drying and calcination. The electrification of these specific thermal processes for LFP CAM is undemonstrated at production scale. The Brindisi plant would be the first to validate this combination and generate primary LFP-specific electrification energy and GHG data.",
      "supported_by": ["SRC-016", "SRC-017", "SRC-018", "SRC-019", "SRC-020", "SRC-022", "SRC-025", "SRC-ED-004", "SRC-ED-005", "SRC-ED-006", "SRC-ED-007", "SRC-ED-008", "SRC-ED-009", "SRC-ED-010", "SRC-ED-013", "SRC-ED-016", "SRC-ED-017", "SRC-ED-023"],
      "confidence": "medium",
      "attack_surface": "An evaluator could argue: (a) electrified kilns and dryers are commercially available equipment — the novelty is in procurement, not innovation; (b) FREYR's Finnish project may also use electrified process heat once built (though not documented and FID is uncertain); (c) the GHG benefit depends on grid carbon intensity which is an external factor, not a process innovation; (d) the current Italian grid (310 gCO2/kWh) is actually worse than gas combustion, making the GHG claim time-dependent. Defense: the temporal argument is the core of the framing — the plant is designed for the 2030 grid, not the 2025 grid. Italy will cross the gas-breakeven threshold (~180 gCO2/kWh) by ~2027–2028 per NECP trajectory. Electrifying now locks in a future-proof design before fossil fuel infrastructure becomes stranded. The novelty lies in the combination of electrification with DT-optimized process control for LFP-specific chemistry, and in delivering the first quantitative analog-based GHG calculation using 24 primary sources.",
      "defensibility_score": 7,
      "related_claims": ["CLM-010", "CLM-011", "CLM-012", "CLM-021", "CLM-023", "CLM-024", "CLM-025", "CLM-026", "CLM-027", "CLM-029", "CLM-030"]
    },
    {
      "anchor_id": "NOV-003",
      "claim": "First application of ISO 23247 digital manufacturing framework to thermal/chemical powder synthesis, combined with multi-scale physics-based modeling (DFT to plant scale) for real-time process control in CAM manufacturing.",
      "novelty_type": "combination",
      "dimension": "integration",
      "existing_art": "ISO 23247 implementations exist for CNC machining [SRC-007, SRC-009], automotive body shop inspection [SRC-010], and additive manufacturing — all discrete manufacturing domains. Multi-scale modeling frameworks spanning DFT to continuum scales exist for battery electrode manufacturing [SRC-003, SRC-004] and individual process models exist for sintering furnaces [SRC-014]. Neither has been combined under ISO 23247 for chemical powder processes.",
      "gap": "The combination of (a) ISO 23247 four-layer architecture with (b) multi-scale physics-based models spanning atomistic to plant scales, applied to (c) continuous/batch chemical powder synthesis, is novel. Each component exists independently but the integration is unprecedented.",
      "supported_by": ["SRC-007", "SRC-008", "SRC-009", "SRC-010", "SRC-014", "SRC-DT-REPORT"],
      "confidence": "high",
      "attack_surface": "An evaluator could argue: (a) this is merely a systems integration exercise, assembling known components — the novelty is in the glue, not the bricks; (b) ISO 23247 was designed for discrete manufacturing and may require non-trivial extensions for chemical processes, undermining the claim of standards-compliant implementation; (c) multi-scale modeling from DFT to plant is aspirational — actually achieving real-time DFT-informed control at production speed is implausible. Defense: combination novelty is explicitly recognized in innovation scoring. The ISO 23247 standard's functional decomposition is general enough for chemical processes (confirmed by framework analysis in the deep-dive report). The multi-scale chain uses surrogate models/reduced-order models at higher levels, not real-time DFT.",
      "defensibility_score": 7,
      "related_claims": ["CLM-005", "CLM-008", "CLM-018"]
    },
    {
      "anchor_id": "NOV-004",
      "claim": "First LFP cathode active material production facility in Italy and Southern Europe, directly addressing the EU strategic autonomy gap in battery material supply chains.",
      "novelty_type": "first",
      "dimension": "application",
      "existing_art": "No LFP CAM production exists in the EU as of late 2025 [SRC-023]. FREYR has a funded project for LFP CAM in Vaasa, Finland (Northern Europe) [SRC-025]. CATL is expanding cell production in Europe but LFP CAM production status is unclear [SRC-023]. Umicore produces NMC cathodes in Poland but not LFP [SRC-023].",
      "gap": "Southern Europe has no LFP CAM manufacturing capacity. The Brindisi location provides geographic diversification within EU LFP supply, complementing FREYR's Northern European site, and addresses Mediterranean access for Southern European battery cell manufacturers.",
      "supported_by": ["SRC-023", "SRC-024", "SRC-025"],
      "confidence": "medium",